{
  "width": 195,
  "height": 136,
  "texture": "santest:guis/test.png",
  "backgroundElements": [
    {
      "type": "texture",
      "data": {
        "size": [195, 136],
        "uv": [0, 0]
      }
    },
    {
      "type": "button",
      "pos": [-50, 0],
      "data": {
        "size": [50, 60],
        "label": "testing\ntesting2"
      }
    },
    {
      "type": "group_box",
      "pos": [5, 5],
      "data": {
        "size": [186, 127],
        "title": {
          "text": "test"
        }
      }
    }
  ],
  "foregroundElements": [
    {
      "type": "tooltip",
      "pos": [0, 0],
      "data": {
        "size": [16, 16],
        "content": {
          "type": "text",
          "data": {
            "text": "Bedrock",
            "shadow": true,
            "color": "FFFFFF"
          }
        }
      }
    },
    {
      "type": "tooltip",
      "pos": [16, 0],
      "data": {
        "size": [16, 16],
        "content": {
          "type": "rectangle",
          "data": {
            "size": [10, 10],
            "color": ["0xFFFFFF00", "0xFFFF0000"]
          }
        }
      }
    },
    {
      "type": "_stack_panel",
      "pos": [8, 16],
      "data": {
        "content": [
          {
            "type": "rectangle",
            "data": {
              "size": [10, 10],
              "color": ["0xFF00FF00"]
            }
          },
          {
            "type": "stack_panel",
            "pos": [0, 0],
            "data": {
              "horizontal": true,
              "padding": [5],
              "content": [
                {
                  "type": "rectangle",
                  "data": {
                    "size": [35, 5],
                    "color": ["0xFFFFFF00"]
                  }
                },
                {
                  "type": "rectangle",
                  "data": {
                    "size": [15, 9],
                    "color": ["0xFFFF0000"]
                  }
                }
              ]
            }
          },
          {
            "type": "rectangle",
            "data": {
              "size": [10, 10],
              "color": ["0xFF0000FF"]
            }
          }
        ]
      }
    },
    {
      "type": "scroll_area",
      "pos": [9, 18],
      "data": {
        "rasterized": true,
        "areaSize": [160, 110],
        "scrollbarHeight": 110,
        "scrollbarPos": [175, 18],
        "scrollButton": {
            "size": [12, 15],
            "uv": [232, 0],
            "uvDisabled": [244, 0]
        },
        "elements": [
          {
            "type": "rectangle",
            "pos": [0, 0],
            "data": {
              "size": [100, 110],
              "color": ["0xFFFFFF00", "0xFFFF0000"]
            }
          },
          {
            "type": "rectangle",
            "pos": [0, 110],
            "data": {
              "size": [100, 110],
              "color": ["0xFF00FFFF", "0xFF0000FF"]
            }
          },
          {
            "type": "rectangle",
            "pos": [0, 220],
            "data": {
              "size": [100, 110],
              "color": ["0xFFFF00FF", "0xFF00FF00"]
            }
          }
        ]
      }
    }
  ]
}