{
  "width": 195,
  "height": 136,
  "texture": "santest:lexicon/test.png",
  "backgroundElements": [
    {
      "type": "texture",
      "pos": [0, 0],
      "data": {
        "size": [195, 136],
        "uv": [0, 0]
      }
    },{
      "type": "scroll_area",
      "pos": [9, 18],
	  "id": "contentPane",
      "data": {
        "areaSize": [160, 110],
        "scrollbarHeight": 110,
        "scrollbarPos": [175, 18],
        "scrollButton": {
            "size": [12, 15],
            "uv": [232, 0],
            "uvDisabled": [244, 0]
        },
        "elements": []
      }
    }
  ],
  "foregroundElements": []
}